{
  "decision_id": "AD-SIG-003-20260208140000",
  "market": "SOL-PERP",
  "status": "SURVEILLANCE",
  "confidence_level": "MEDIUM",
  "edge_net": 1.2,
  "constraints": {
    "max_size": 200000,
    "urgency": "MEDIUM",
    "expiry": "2026-02-10T02:00:00"
  },
  "rules_passed": [1, 2, 3, 4, 5, 6, 7, 8, 9, 10],
  "rules_failed": [],
  "audit_ref": "[2026-02-08T14:00:00]-SIG-003",
  "schema_version": "1.0.0",
  "generated_at": "2026-02-08T14:00:00"
}
